{
  "instance_pseudonym": "pseudo-0a1b2c3d4e5f60718293a4b5c6d7e8f9",
  "first_seen_at": "2026-08-01T00:00:00Z",
  "last_seen_at": "2026-09-15T03:00:00Z",
  "bundle_version": "v3.2.4.4",
  "schema_version": "v1.0.0",
  "feature_registry_version": "v1.0.0",
  "adapter_versions": {
    "wazuh": "v1.2.3"
  },
  "tool_catalog_version": "v1.0.0",
  "topology_mode": "hybrid",
  "health_status": "healthy",
  "last_successful_replay_timestamp": "2026-09-15T02:00:00Z",
  "last_audit_chain_verification_timestamp": "2026-09-15T02:30:00Z",
  "last_update_applied_version": "v3.2.4.4",
  "failed_update_attempts_count": 0,
  "disabled_capabilities": []
}
